{
  "session_id": "051f64f7-ecd0-4df6-b2bb-74b47290916a",
  "generated_at": "2026-01-07T13:08:21.968935Z",
  "checkpoints": [
    {
      "checkpoint_id": "ea04d8d1-2d06-418f-9439-7527e25de476",
      "commit_sha": "b9dc8fd35ba862a6b43a7fb1f681f09eba00b4d7",
      "timestamp": "2026-01-07T13:08:21.966516Z",
      "description": "Feature implementation complete",
      "phase": "implement",
      "checkpoint_type": "phase_complete",
      "tags": [
        "checkpoint-ea04d8d1-2d06-418f-9439-7527e25de476"
      ],
      "rollback_used": false,
      "rollback_count": 0,
      "state_snapshot": {
        "tasks_completed": 25,
        "decisions_made": 12,
        "files_modified": 45,
        "files_created": 28,
        "tests_passing": 87,
        "tests_failing": 0
      }
    }
  ],
  "summary": {
    "total_checkpoints": 1,
    "checkpoints_by_type": {
      "phase_complete": 1
    },
    "checkpoints_used_for_rollback": 0,
    "latest_checkpoint": "b9dc8fd35ba862a6b43a7fb1f681f09eba00b4d7"
  }
}