{
  "session_id": "b2f66ee1-c9bd-4ba7-9c18-80f3904c14e3",
  "generated_at": "2026-01-07T13:08:21.898013Z",
  "checkpoints": [
    {
      "checkpoint_id": "0d827631-347d-4406-904a-9bee4d0ae072",
      "commit_sha": "b9dc8fd35ba862a6b43a7fb1f681f09eba00b4d7",
      "timestamp": "2026-01-07T13:08:21.894907Z",
      "description": "Plan complete",
      "phase": "plan",
      "checkpoint_type": "phase_complete",
      "tags": [
        "checkpoint-0d827631-347d-4406-904a-9bee4d0ae072"
      ],
      "rollback_used": false,
      "rollback_count": 0
    },
    {
      "checkpoint_id": "1e7161c2-55d0-4c74-8bab-5d5e078633e3",
      "commit_sha": "b9dc8fd35ba862a6b43a7fb1f681f09eba00b4d7",
      "timestamp": "2026-01-07T13:08:21.909825Z",
      "description": "Tasks generated",
      "phase": "generate_tasks",
      "checkpoint_type": "phase_complete",
      "tags": [
        "checkpoint-1e7161c2-55d0-4c74-8bab-5d5e078633e3"
      ],
      "rollback_used": false,
      "rollback_count": 0
    },
    {
      "checkpoint_id": "9b747a43-7d9f-4073-9635-83c8e60e1290",
      "commit_sha": "b9dc8fd35ba862a6b43a7fb1f681f09eba00b4d7",
      "timestamp": "2026-01-07T13:08:21.923037Z",
      "description": "Safe state 1",
      "phase": "implement",
      "checkpoint_type": "safe_state",
      "tags": [
        "checkpoint-9b747a43-7d9f-4073-9635-83c8e60e1290"
      ],
      "rollback_used": false,
      "rollback_count": 0
    },
    {
      "checkpoint_id": "c31c6e8d-b056-4b52-be25-31d0d1200e8e",
      "commit_sha": "b9dc8fd35ba862a6b43a7fb1f681f09eba00b4d7",
      "timestamp": "2026-01-07T13:08:21.937153Z",
      "description": "Feature done",
      "phase": "implement",
      "checkpoint_type": "task_group_complete",
      "tags": [
        "checkpoint-c31c6e8d-b056-4b52-be25-31d0d1200e8e"
      ],
      "rollback_used": false,
      "rollback_count": 0
    },
    {
      "checkpoint_id": "5815a713-4272-4b56-ac17-e82c19e9333b",
      "commit_sha": "b9dc8fd35ba862a6b43a7fb1f681f09eba00b4d7",
      "timestamp": "2026-01-07T13:08:21.951311Z",
      "description": "Safe state 2",
      "phase": "implement",
      "checkpoint_type": "safe_state",
      "tags": [
        "checkpoint-5815a713-4272-4b56-ac17-e82c19e9333b"
      ],
      "rollback_used": false,
      "rollback_count": 0
    }
  ],
  "summary": {
    "total_checkpoints": 5,
    "checkpoints_by_type": {
      "phase_complete": 2,
      "safe_state": 2,
      "task_group_complete": 1
    },
    "checkpoints_used_for_rollback": 0,
    "latest_checkpoint": "b9dc8fd35ba862a6b43a7fb1f681f09eba00b4d7"
  }
}