{
  "session_id": "example-session",
  "generated_at": "2026-01-07T13:10:11.815641Z",
  "checkpoints": [
    {
      "checkpoint_id": "cp-1767762611",
      "timestamp": "2026-01-07T13:10:11.815577Z",
      "commit_sha": "b9dc8fd35ba862a6b43a7fb1f681f09eba00b4d7",
      "commit_message": "added last-tpuch to gitignore",
      "description": "Before making changes",
      "phase": "implement",
      "checkpoint_type": "pre_risky_operation",
      "state_snapshot": {
        "tasks_completed": 3,
        "files_modified": 5
      },
      "tags": [],
      "rollback_used": false,
      "rollback_count": 0
    }
  ],
  "summary": {
    "total_checkpoints": 1,
    "checkpoints_by_type": {
      "pre_risky_operation": 1
    },
    "checkpoints_used_for_rollback": 0,
    "latest_checkpoint": "b9dc8fd35ba862a6b43a7fb1f681f09eba00b4d7"
  }
}