{
  "session_id": "65622e17-5067-4605-8313-58024e0901d1",
  "generated_at": "2026-01-07T13:08:21.818720Z",
  "checkpoints": [
    {
      "checkpoint_id": "6479a610-b890-4d1a-b837-a9ba6946463c",
      "commit_sha": "b9dc8fd35ba862a6b43a7fb1f681f09eba00b4d7",
      "timestamp": "2026-01-07T13:08:21.816298Z",
      "description": "Implementation milestone reached",
      "phase": "implement",
      "checkpoint_type": "task_group_complete",
      "tags": [
        "checkpoint-6479a610-b890-4d1a-b837-a9ba6946463c"
      ],
      "rollback_used": false,
      "rollback_count": 0,
      "state_snapshot": {
        "tasks_completed": 15,
        "decisions_made": 8,
        "files_modified": 23,
        "files_created": 12,
        "tests_passing": 42,
        "tests_failing": 1
      }
    }
  ],
  "summary": {
    "total_checkpoints": 1,
    "checkpoints_by_type": {
      "task_group_complete": 1
    },
    "checkpoints_used_for_rollback": 0,
    "latest_checkpoint": "b9dc8fd35ba862a6b43a7fb1f681f09eba00b4d7"
  }
}