{
  "session_id": "workflow-example",
  "generated_at": "2026-01-07T13:10:11.820540Z",
  "checkpoints": [
    {
      "checkpoint_id": "cp-1767762611",
      "timestamp": "2026-01-07T13:10:11.820476Z",
      "commit_sha": "b9dc8fd35ba862a6b43a7fb1f681f09eba00b4d7",
      "commit_message": "added last-tpuch to gitignore",
      "description": "Before implementing user authentication",
      "phase": "implement",
      "checkpoint_type": "safe_state",
      "state_snapshot": {},
      "tags": [],
      "rollback_used": false,
      "rollback_count": 0
    }
  ],
  "summary": {
    "total_checkpoints": 1,
    "checkpoints_by_type": {
      "safe_state": 1
    },
    "checkpoints_used_for_rollback": 0,
    "latest_checkpoint": "b9dc8fd35ba862a6b43a7fb1f681f09eba00b4d7"
  }
}