{
  "session_id": "5c9467dc-5f08-4e2b-9f8a-f53bd6877847",
  "generated_at": "2026-01-07T13:08:21.856307Z",
  "checkpoints": [
    {
      "checkpoint_id": "496b1d99-8df1-4954-8701-479cad938844",
      "commit_sha": "b9dc8fd35ba862a6b43a7fb1f681f09eba00b4d7",
      "timestamp": "2026-01-07T13:08:21.853234Z",
      "description": "Stable state before changes",
      "phase": "implement",
      "checkpoint_type": "safe_state",
      "tags": [
        "checkpoint-496b1d99-8df1-4954-8701-479cad938844"
      ],
      "rollback_used": false,
      "rollback_count": 0
    },
    {
      "checkpoint_id": "f7931d6d-032d-480d-bbda-6cf0bb278f56",
      "commit_sha": "b9dc8fd35ba862a6b43a7fb1f681f09eba00b4d7",
      "timestamp": "2026-01-07T13:08:21.867193Z",
      "description": "After implementing new feature",
      "phase": "implement",
      "checkpoint_type": "task_group_complete",
      "tags": [
        "checkpoint-f7931d6d-032d-480d-bbda-6cf0bb278f56"
      ],
      "rollback_used": false,
      "rollback_count": 0
    }
  ],
  "summary": {
    "total_checkpoints": 2,
    "checkpoints_by_type": {
      "safe_state": 1,
      "task_group_complete": 1
    },
    "checkpoints_used_for_rollback": 0,
    "latest_checkpoint": "b9dc8fd35ba862a6b43a7fb1f681f09eba00b4d7"
  }
}